{
  "schema_version": 1,
  "task_id": "reread-scope-review",
  "agent": {
    "provider": "codex",
    "role": "reconciler"
  },
  "status": "partial",
  "summary": "Consolidated two independent read-only reviews; corrected scoped UI defects and unsupported completion claims.",
  "base_sha": "d9525d26b4235333d974ec0e4bdccf12c705e29c",
  "changes": [
    "ShiftHistoryPanel.tsx",
    "ShiftGate.tsx",
    "CurrentShiftSummary.tsx",
    "reports-surface.css",
    "language packs",
    "shiftManagement.test.ts",
    "progress and review ledger"
  ],
  "evidence": [
    {
      "claim": "True two-layer navigation is incomplete",
      "locator": "frontend/src/components/shared/HubSectionNav.tsx:214; frontend/src/components/navigation/Sidebar.tsx:465",
      "observed": "Product designer found separate hub entry/history layer and branded header; lead agrees."
    },
    {
      "claim": "Attribution draft should not ship",
      "locator": "docs/fleet/evidence/shift-attribution-unfinished-2026-09-05.patch",
      "observed": "Architect found checkout, timestamp, branch/fee ownership and report/backup hazards. Architect favored separate lifecycle retention; lead deferred lifecycle too until older-backup restore and rendering are completed."
    },
    {
      "claim": "Scoped history fixes rereviewed",
      "locator": "frontend/src/components/shifts/ShiftHistoryPanel.tsx",
      "observed": "Product designer final rereview confirmed guarded save and translated titles; no remaining bounded findings. Browser evidence lead-owned."
    }
  ],
  "verification": [
    {
      "command": "node tests/shiftManagement.test.ts",
      "scope": "frontend",
      "exit_code": 0,
      "expected": "all focused checks pass",
      "observed": "39 checks passed"
    },
    {
      "command": "node tests/shiftGate.test.ts",
      "scope": "frontend",
      "exit_code": 0,
      "expected": "all focused checks pass",
      "observed": "47 checks passed"
    },
    {
      "command": "npm run typecheck",
      "scope": "frontend and cloudflare separately",
      "exit_code": 0,
      "expected": "no type errors",
      "observed": "passed"
    },
    {
      "command": "npm run verify:i18n",
      "scope": "frontend",
      "exit_code": 0,
      "expected": "key parity",
      "observed": "4863 keys"
    },
    {
      "command": "Playwright CLI local real-component fixture",
      "scope": "320/375 EN/KM samples",
      "exit_code": 0,
      "expected": "no horizontal overflow and cash-only edit discard protection",
      "observed": "page widths equal viewports, sampled320 inputs244/244; discard dialog rendered"
    }
  ],
  "risks": [
    "Source contracts do not simulate every request race.",
    "Local fixture is not authenticated full-app certification.",
    "Existing build circular-chunk/size warnings."
  ],
  "not_done": [
    "True mobile two-layer/header implementation",
    "Broad authenticated responsive and scope matrix",
    "Production reconciliation and partial-payment ruling",
    "Lifecycle immutable original-event completion"
  ],
  "handoff": "See docs/fleet/2026-09-05-scope-review.md; no deployment or remote data operation."
}
